{
  "id": "quality.standard",
  "name": "Quality Standard",
  "name_zh": "质量标准",
  "description": "Apply standard quality enhancements.",
  "description_zh": "应用标准质量增强",
  "category": "quality",
  "subcategories": [
    "basic",
    "technical",
    "advanced",
    "render-resolution",
    "texture"
  ],
  "language": [
    "en",
    "zh"
  ],
  "api_targets": [
    "SDXL",
    "Midjourney",
    "Flux"
  ],
  "lifecycle": "approved",
  "score": 0.95,
  "tags": [
    "quality",
    "standard",
    "enhancement"
  ],
  "variables": [
    {
      "name": "quality_level",
      "type": "keyword",
      "required": true,
      "description": "Quality level"
    },
    {
      "name": "technical_specs",
      "type": "keyword",
      "required": false,
      "description": "Technical specifications"
    },
    {
      "name": "render_quality",
      "type": "keyword",
      "required": false,
      "description": "Render quality"
    },
    {
      "name": "resolution",
      "type": "keyword",
      "required": false,
      "description": "Output resolution"
    },
    {
      "name": "texture_quality",
      "type": "keyword",
      "required": false,
      "description": "Texture quality"
    }
  ],
  "variants": [
    {
      "id": "quality.standard.masterpiece",
      "description": "Masterpiece quality"
    },
    {
      "id": "quality.standard.hdr",
      "description": "HDR quality"
    }
  ],
  "examples": [
    "masterpiece, best quality, highres"
  ],
  "created_at": "2026-10-11",
  "updated_at": "2026-10-11T13:38:07.159481+00:00",
  "notes": "Used in comic_panel_full workflow"
}