{
  "id": "lighting.mood",
  "name": "Lighting Mood",
  "name_zh": "灯光氛围",
  "description": "Describe lighting mood and atmosphere.",
  "description_zh": "描述灯光氛围和情绪",
  "category": "lighting",
  "subcategories": [
    "mj_v5_lighting",
    "mood",
    "natural",
    "special"
  ],
  "language": [
    "en",
    "zh"
  ],
  "api_targets": [
    "SDXL",
    "Midjourney",
    "Flux"
  ],
  "lifecycle": "approved",
  "score": 0.9,
  "tags": [
    "lighting",
    "mood",
    "atmosphere"
  ],
  "variables": [
    {
      "name": "light_type",
      "type": "keyword",
      "required": true,
      "description": "Type of lighting",
      "default": "cinematic"
    },
    {
      "name": "mood",
      "type": "keyword",
      "required": true,
      "description": "Mood and feeling"
    },
    {
      "name": "natural_light",
      "type": "keyword",
      "required": false,
      "description": "Natural lighting effects"
    },
    {
      "name": "special_effects",
      "type": "keyword",
      "required": false,
      "description": "Special lighting effects"
    }
  ],
  "variants": [
    {
      "id": "lighting.mood.dramatic",
      "description": "Dramatic lighting"
    },
    {
      "id": "lighting.mood.soft",
      "description": "Soft lighting"
    }
  ],
  "examples": [
    "cinematic lighting, dramatic shadows"
  ],
  "created_at": "2026-10-11",
  "updated_at": "2026-10-11T13:38:07.159467+00:00",
  "notes": "Used in comic_panel_full, scene_design workflows"
}