{
  "id": "camera.shot_type",
  "name": "Camera Shot Type",
  "name_zh": "摄像机景别",
  "description": "Describe camera shot type for video generation.",
  "description_zh": "描述摄像机景别（视频生成用）",
  "category": "camera",
  "subcategories": [],
  "language": [
    "en",
    "zh"
  ],
  "api_targets": [
    "Kling",
    "Runway",
    "Minimax H3"
  ],
  "lifecycle": "review",
  "score": 0.8,
  "tags": [
    "camera",
    "shot_type",
    "video"
  ],
  "variables": [
    {
      "name": "shot_type",
      "type": "static",
      "required": true,
      "description": "Type of shot (extreme long, long, medium, close-up, extreme close-up)"
    },
    {
      "name": "framing",
      "type": "static",
      "required": false,
      "description": "Framing style (rule of thirds, centered, dynamic)"
    },
    {
      "name": "subject_focus",
      "type": "static",
      "required": false,
      "description": "What the camera focuses on"
    }
  ],
  "variants": [
    {
      "id": "camera.shot_type.medium",
      "description": "Medium shot"
    },
    {
      "id": "camera.shot_type.closeup",
      "description": "Close-up shot"
    }
  ],
  "examples": [
    "medium shot, centered framing"
  ],
  "created_at": "2026-10-11",
  "updated_at": "2026-10-11T13:38:07.159487+00:00",
  "notes": "Used in video_storyboard workflow. Beta: no corresponding keywords yet."
}