{
  "id": "color.grading",
  "name": "Color Grading",
  "name_zh": "色彩分级",
  "description": "Apply color grading and visual tone.",
  "description_zh": "应用色彩分级和视觉色调",
  "category": "color-look",
  "subcategories": [
    "palette",
    "film-emulation",
    "post-process"
  ],
  "language": [
    "en",
    "zh"
  ],
  "api_targets": [
    "SDXL",
    "Midjourney",
    "Flux"
  ],
  "lifecycle": "approved",
  "score": 0.85,
  "tags": [
    "color",
    "grading",
    "tone"
  ],
  "variables": [
    {
      "name": "palette",
      "type": "keyword",
      "required": true,
      "description": "Color palette"
    },
    {
      "name": "film_emulation",
      "type": "keyword",
      "required": false,
      "description": "Film emulation style"
    },
    {
      "name": "post_process",
      "type": "keyword",
      "required": false,
      "description": "Post-processing effects"
    }
  ],
  "variants": [
    {
      "id": "color.grading.warm",
      "description": "Warm color grading"
    },
    {
      "id": "color.grading.cool",
      "description": "Cool color grading"
    }
  ],
  "examples": [
    "warm color grading, cinematic look"
  ],
  "created_at": "2026-10-11",
  "updated_at": "2026-10-11T13:38:07.159474+00:00",
  "notes": "Used in scene_design workflow"
}